#-----------------------------------------------------------
# Vivado v2019.2 (64-bit)
# SW Build 2708876 on Wed Nov  6 21:39:14 MST 2019
# IP Build 2700528 on Thu Nov  7 00:09:20 MST 2019
# Start of session at: Mon May  4 11:16:29 2020
# Process ID: 5691
# Current directory: /home/gigo/neural_net_HLS/solution1/impl/vhdl
# Command line: vivado -notrace -mode batch -source run_vivadosyn.tcl
# Log file: /home/gigo/neural_net_HLS/solution1/impl/vhdl/vivado.log
# Journal file: /home/gigo/neural_net_HLS/solution1/impl/vhdl/vivado.jou
#-----------------------------------------------------------
source run_vivadosyn.tcl -notrace
INFO: [IP_Flow 19-234] Refreshing IP repositories
INFO: [IP_Flow 19-1700] Loaded user IP repository '/home/gigo/neural_net_HLS/solution1/impl/ip'.
INFO: [IP_Flow 19-2313] Loaded Vivado IP repository '/opt/Xilinx/Vivado/2019.2/data/ip'.
Wrote  : </home/gigo/neural_net_HLS/solution1/impl/vhdl/project.srcs/sources_1/bd/bd_0/bd_0.bd> 
WARNING: [BD 41-927] Following properties on pin /hls_inst/ap_clk have been updated from connected ip. They may not be synchronized with cell properties. You can set property on pin directly to confirm the value and resolve the warning.
	FREQ_HZ=100000000.0 
Wrote  : </home/gigo/neural_net_HLS/solution1/impl/vhdl/project.srcs/sources_1/bd/bd_0/bd_0.bd> 
VHDL Output written to : /home/gigo/neural_net_HLS/solution1/impl/vhdl/project.srcs/sources_1/bd/bd_0/synth/bd_0.vhd
VHDL Output written to : /home/gigo/neural_net_HLS/solution1/impl/vhdl/project.srcs/sources_1/bd/bd_0/sim/bd_0.vhd
VHDL Output written to : /home/gigo/neural_net_HLS/solution1/impl/vhdl/project.srcs/sources_1/bd/bd_0/hdl/bd_0_wrapper.vhd
Using BD top: bd_0_wrapper
INFO: [BD 41-1662] The design 'bd_0.bd' is already validated. Therefore parameter propagation will not be re-run.
VHDL Output written to : /home/gigo/neural_net_HLS/solution1/impl/vhdl/project.srcs/sources_1/bd/bd_0/synth/bd_0.vhd
VHDL Output written to : /home/gigo/neural_net_HLS/solution1/impl/vhdl/project.srcs/sources_1/bd/bd_0/sim/bd_0.vhd
VHDL Output written to : /home/gigo/neural_net_HLS/solution1/impl/vhdl/project.srcs/sources_1/bd/bd_0/hdl/bd_0_wrapper.vhd
INFO: [BD 41-1029] Generation completed for the IP Integrator block hls_inst .
Exporting to file /home/gigo/neural_net_HLS/solution1/impl/vhdl/project.srcs/sources_1/bd/bd_0/hw_handoff/bd_0.hwh
Generated Block Design Tcl file /home/gigo/neural_net_HLS/solution1/impl/vhdl/project.srcs/sources_1/bd/bd_0/hw_handoff/bd_0_bd.tcl
Generated Hardware Definition File /home/gigo/neural_net_HLS/solution1/impl/vhdl/project.srcs/sources_1/bd/bd_0/synth/bd_0.hwdef
launch_runs: Time (s): cpu = 00:00:05 ; elapsed = 00:00:05 . Memory (MB): peak = 1633.340 ; gain = 16.230 ; free physical = 9021 ; free virtual = 13801
[Mon May  4 11:16:47 2020] Launched bd_0_hls_inst_0_synth_1...
Run output will be captured here: /home/gigo/neural_net_HLS/solution1/impl/vhdl/project.runs/bd_0_hls_inst_0_synth_1/runme.log
[Mon May  4 11:16:47 2020] Launched synth_1...
Run output will be captured here: /home/gigo/neural_net_HLS/solution1/impl/vhdl/project.runs/synth_1/runme.log
[Mon May  4 11:16:47 2020] Waiting for synth_1 to finish...

*** Running vivado
    with args -log bd_0_wrapper.vds -m64 -product Vivado -mode batch -messageDb vivado.pb -notrace -source bd_0_wrapper.tcl


****** Vivado v2019.2 (64-bit)
  **** SW Build 2708876 on Wed Nov  6 21:39:14 MST 2019
  **** IP Build 2700528 on Thu Nov  7 00:09:20 MST 2019
    ** Copyright 1986-2019 Xilinx, Inc. All Rights Reserved.

source bd_0_wrapper.tcl -notrace
INFO: [IP_Flow 19-234] Refreshing IP repositories
INFO: [IP_Flow 19-1700] Loaded user IP repository '/home/gigo/neural_net_HLS/solution1/impl/ip'.
INFO: [IP_Flow 19-2313] Loaded Vivado IP repository '/opt/Xilinx/Vivado/2019.2/data/ip'.
Command: synth_design -top bd_0_wrapper -part xc7a35tcpg236-1 -mode out_of_context
Starting synth_design
Attempting to get a license for feature 'Synthesis' and/or device 'xc7a35t'
INFO: [Common 17-349] Got license for feature 'Synthesis' and/or device 'xc7a35t'
INFO: [Device 21-403] Loading part xc7a35tcpg236-1
INFO: Launching helper process for spawning children vivado processes
INFO: Helper process launched with PID 5997 
---------------------------------------------------------------------------------
Starting RTL Elaboration : Time (s): cpu = 00:00:05 ; elapsed = 00:00:07 . Memory (MB): peak = 1849.871 ; gain = 203.684 ; free physical = 8144 ; free virtual = 13051
---------------------------------------------------------------------------------
INFO: [Synth 8-638] synthesizing module 'bd_0_wrapper' [/home/gigo/neural_net_HLS/solution1/impl/vhdl/project.srcs/sources_1/bd/bd_0/hdl/bd_0_wrapper.vhd:30]
INFO: [Synth 8-3491] module 'bd_0' declared at '/home/gigo/neural_net_HLS/solution1/impl/vhdl/project.srcs/sources_1/bd/bd_0/synth/bd_0.vhd:14' bound to instance 'bd_0_i' of component 'bd_0' [/home/gigo/neural_net_HLS/solution1/impl/vhdl/project.srcs/sources_1/bd/bd_0/hdl/bd_0_wrapper.vhd:47]
INFO: [Synth 8-638] synthesizing module 'bd_0' [/home/gigo/neural_net_HLS/solution1/impl/vhdl/project.srcs/sources_1/bd/bd_0/synth/bd_0.vhd:34]
INFO: [Synth 8-3491] module 'bd_0_hls_inst_0' declared at '/home/gigo/neural_net_HLS/solution1/impl/vhdl/project.runs/synth_1/.Xil/Vivado-5991-gigo-MacBookPro/realtime/bd_0_hls_inst_0_stub.vhdl:5' bound to instance 'hls_inst' of component 'bd_0_hls_inst_0' [/home/gigo/neural_net_HLS/solution1/impl/vhdl/project.srcs/sources_1/bd/bd_0/synth/bd_0.vhd:88]
INFO: [Synth 8-638] synthesizing module 'bd_0_hls_inst_0' [/home/gigo/neural_net_HLS/solution1/impl/vhdl/project.runs/synth_1/.Xil/Vivado-5991-gigo-MacBookPro/realtime/bd_0_hls_inst_0_stub.vhdl:22]
INFO: [Synth 8-256] done synthesizing module 'bd_0' (1#1) [/home/gigo/neural_net_HLS/solution1/impl/vhdl/project.srcs/sources_1/bd/bd_0/synth/bd_0.vhd:34]
INFO: [Synth 8-256] done synthesizing module 'bd_0_wrapper' (2#1) [/home/gigo/neural_net_HLS/solution1/impl/vhdl/project.srcs/sources_1/bd/bd_0/hdl/bd_0_wrapper.vhd:30]
---------------------------------------------------------------------------------
Finished RTL Elaboration : Time (s): cpu = 00:00:06 ; elapsed = 00:00:09 . Memory (MB): peak = 1913.590 ; gain = 267.402 ; free physical = 8183 ; free virtual = 13088
---------------------------------------------------------------------------------

Report Check Netlist: 
+------+------------------+-------+---------+-------+------------------+
|      |Item              |Errors |Warnings |Status |Description       |
+------+------------------+-------+---------+-------+------------------+
|1     |multi_driven_nets |      0|        0|Passed |Multi driven nets |
+------+------------------+-------+---------+-------+------------------+
---------------------------------------------------------------------------------
Start Handling Custom Attributes
---------------------------------------------------------------------------------
---------------------------------------------------------------------------------
Finished Handling Custom Attributes : Time (s): cpu = 00:00:07 ; elapsed = 00:00:09 . Memory (MB): peak = 1913.590 ; gain = 267.402 ; free physical = 8178 ; free virtual = 13082
---------------------------------------------------------------------------------
---------------------------------------------------------------------------------
Finished RTL Optimization Phase 1 : Time (s): cpu = 00:00:07 ; elapsed = 00:00:09 . Memory (MB): peak = 1913.590 ; gain = 267.402 ; free physical = 8178 ; free virtual = 13082
---------------------------------------------------------------------------------
Netlist sorting complete. Time (s): cpu = 00:00:00.01 ; elapsed = 00:00:00 . Memory (MB): peak = 1913.590 ; gain = 0.000 ; free physical = 8170 ; free virtual = 13075
INFO: [Project 1-570] Preparing netlist for logic optimization

Processing XDC Constraints
Initializing timing engine
Parsing XDC File [/home/gigo/neural_net_HLS/solution1/impl/vhdl/project.srcs/sources_1/bd/bd_0/ip/bd_0_hls_inst_0/bd_0_hls_inst_0/bd_0_hls_inst_0_in_context.xdc] for cell 'bd_0_i/hls_inst'
Finished Parsing XDC File [/home/gigo/neural_net_HLS/solution1/impl/vhdl/project.srcs/sources_1/bd/bd_0/ip/bd_0_hls_inst_0/bd_0_hls_inst_0/bd_0_hls_inst_0_in_context.xdc] for cell 'bd_0_i/hls_inst'
Parsing XDC File [/home/gigo/neural_net_HLS/solution1/impl/vhdl/kernel.xdc]
Finished Parsing XDC File [/home/gigo/neural_net_HLS/solution1/impl/vhdl/kernel.xdc]
Parsing XDC File [/home/gigo/neural_net_HLS/solution1/impl/vhdl/project.runs/synth_1/dont_touch.xdc]
Finished Parsing XDC File [/home/gigo/neural_net_HLS/solution1/impl/vhdl/project.runs/synth_1/dont_touch.xdc]
Completed Processing XDC Constraints

Netlist sorting complete. Time (s): cpu = 00:00:00 ; elapsed = 00:00:00 . Memory (MB): peak = 1962.449 ; gain = 0.000 ; free physical = 8091 ; free virtual = 12995
INFO: [Project 1-111] Unisim Transformation Summary:
No Unisim elements were transformed.

Constraint Validation Runtime : Time (s): cpu = 00:00:00.02 ; elapsed = 00:00:00.04 . Memory (MB): peak = 1962.449 ; gain = 0.000 ; free physical = 8091 ; free virtual = 12995
---------------------------------------------------------------------------------
Finished Constraint Validation : Time (s): cpu = 00:00:14 ; elapsed = 00:00:18 . Memory (MB): peak = 1962.449 ; gain = 316.262 ; free physical = 8153 ; free virtual = 13056
---------------------------------------------------------------------------------
---------------------------------------------------------------------------------
Start Loading Part and Timing Information
---------------------------------------------------------------------------------
Loading part: xc7a35tcpg236-1
---------------------------------------------------------------------------------
Finished Loading Part and Timing Information : Time (s): cpu = 00:00:14 ; elapsed = 00:00:18 . Memory (MB): peak = 1962.449 ; gain = 316.262 ; free physical = 8153 ; free virtual = 13056
---------------------------------------------------------------------------------
---------------------------------------------------------------------------------
Start Applying 'set_property' XDC Constraints
---------------------------------------------------------------------------------
Applied set_property DONT_TOUCH = true for bd_0_i. (constraint file  auto generated constraint, line ).
Applied set_property DONT_TOUCH = true for bd_0_i/hls_inst. (constraint file  auto generated constraint, line ).
---------------------------------------------------------------------------------
Finished applying 'set_property' XDC Constraints : Time (s): cpu = 00:00:14 ; elapsed = 00:00:18 . Memory (MB): peak = 1962.449 ; gain = 316.262 ; free physical = 8153 ; free virtual = 13056
---------------------------------------------------------------------------------
---------------------------------------------------------------------------------
Finished RTL Optimization Phase 2 : Time (s): cpu = 00:00:14 ; elapsed = 00:00:18 . Memory (MB): peak = 1962.449 ; gain = 316.262 ; free physical = 8154 ; free virtual = 13058
---------------------------------------------------------------------------------

Report RTL Partitions: 
+-+--------------+------------+----------+
| |RTL Partition |Replication |Instances |
+-+--------------+------------+----------+
+-+--------------+------------+----------+
---------------------------------------------------------------------------------
Start RTL Component Statistics 
---------------------------------------------------------------------------------
Detailed RTL Component Info : 
---------------------------------------------------------------------------------
Finished RTL Component Statistics 
---------------------------------------------------------------------------------
---------------------------------------------------------------------------------
Start RTL Hierarchical Component Statistics 
---------------------------------------------------------------------------------
Hierarchical RTL Component report 
---------------------------------------------------------------------------------
Finished RTL Hierarchical Component Statistics
---------------------------------------------------------------------------------
---------------------------------------------------------------------------------
Start Part Resource Summary
---------------------------------------------------------------------------------
Part Resources:
DSPs: 90 (col length:60)
BRAMs: 100 (col length: RAMB18 60 RAMB36 30)
---------------------------------------------------------------------------------
Finished Part Resource Summary
---------------------------------------------------------------------------------
---------------------------------------------------------------------------------
Start Cross Boundary and Area Optimization
---------------------------------------------------------------------------------
Warning: Parallel synthesis criteria is not met 
---------------------------------------------------------------------------------
Finished Cross Boundary and Area Optimization : Time (s): cpu = 00:00:15 ; elapsed = 00:00:19 . Memory (MB): peak = 1962.449 ; gain = 316.262 ; free physical = 8157 ; free virtual = 13057
---------------------------------------------------------------------------------

Report RTL Partitions: 
+-+--------------+------------+----------+
| |RTL Partition |Replication |Instances |
+-+--------------+------------+----------+
+-+--------------+------------+----------+
---------------------------------------------------------------------------------
Start Applying XDC Timing Constraints
---------------------------------------------------------------------------------
---------------------------------------------------------------------------------
Finished Applying XDC Timing Constraints : Time (s): cpu = 00:00:23 ; elapsed = 00:00:30 . Memory (MB): peak = 1975.449 ; gain = 329.262 ; free physical = 8033 ; free virtual = 12935
---------------------------------------------------------------------------------
---------------------------------------------------------------------------------
Start Timing Optimization
---------------------------------------------------------------------------------
---------------------------------------------------------------------------------
Finished Timing Optimization : Time (s): cpu = 00:00:23 ; elapsed = 00:00:30 . Memory (MB): peak = 1975.449 ; gain = 329.262 ; free physical = 8033 ; free virtual = 12935
---------------------------------------------------------------------------------

Report RTL Partitions: 
+-+--------------+------------+----------+
| |RTL Partition |Replication |Instances |
+-+--------------+------------+----------+
+-+--------------+------------+----------+
---------------------------------------------------------------------------------
Start Technology Mapping
---------------------------------------------------------------------------------
---------------------------------------------------------------------------------
Finished Technology Mapping : Time (s): cpu = 00:00:23 ; elapsed = 00:00:30 . Memory (MB): peak = 1984.465 ; gain = 338.277 ; free physical = 8033 ; free virtual = 12934
---------------------------------------------------------------------------------

Report RTL Partitions: 
+-+--------------+------------+----------+
| |RTL Partition |Replication |Instances |
+-+--------------+------------+----------+
+-+--------------+------------+----------+
---------------------------------------------------------------------------------
Start IO Insertion
---------------------------------------------------------------------------------
---------------------------------------------------------------------------------
Start Flattening Before IO Insertion
---------------------------------------------------------------------------------
---------------------------------------------------------------------------------
Finished Flattening Before IO Insertion
---------------------------------------------------------------------------------
---------------------------------------------------------------------------------
Start Final Netlist Cleanup
---------------------------------------------------------------------------------
---------------------------------------------------------------------------------
Finished Final Netlist Cleanup
---------------------------------------------------------------------------------
---------------------------------------------------------------------------------
Finished IO Insertion : Time (s): cpu = 00:00:27 ; elapsed = 00:00:34 . Memory (MB): peak = 1999.340 ; gain = 353.152 ; free physical = 8034 ; free virtual = 12933
---------------------------------------------------------------------------------
---------------------------------------------------------------------------------
Start Renaming Generated Instances
---------------------------------------------------------------------------------
---------------------------------------------------------------------------------
Finished Renaming Generated Instances : Time (s): cpu = 00:00:27 ; elapsed = 00:00:34 . Memory (MB): peak = 1999.340 ; gain = 353.152 ; free physical = 8034 ; free virtual = 12933
---------------------------------------------------------------------------------

Report RTL Partitions: 
+-+--------------+------------+----------+
| |RTL Partition |Replication |Instances |
+-+--------------+------------+----------+
+-+--------------+------------+----------+

Report Check Netlist: 
+------+------------------+-------+---------+-------+------------------+
|      |Item              |Errors |Warnings |Status |Description       |
+------+------------------+-------+---------+-------+------------------+
|1     |multi_driven_nets |      0|        0|Passed |Multi driven nets |
+------+------------------+-------+---------+-------+------------------+
---------------------------------------------------------------------------------
Start Rebuilding User Hierarchy
---------------------------------------------------------------------------------
---------------------------------------------------------------------------------
Finished Rebuilding User Hierarchy : Time (s): cpu = 00:00:27 ; elapsed = 00:00:34 . Memory (MB): peak = 1999.340 ; gain = 353.152 ; free physical = 8034 ; free virtual = 12933
---------------------------------------------------------------------------------
---------------------------------------------------------------------------------
Start Renaming Generated Ports
---------------------------------------------------------------------------------
---------------------------------------------------------------------------------
Finished Renaming Generated Ports : Time (s): cpu = 00:00:27 ; elapsed = 00:00:34 . Memory (MB): peak = 1999.340 ; gain = 353.152 ; free physical = 8034 ; free virtual = 12933
---------------------------------------------------------------------------------
---------------------------------------------------------------------------------
Start Handling Custom Attributes
---------------------------------------------------------------------------------
---------------------------------------------------------------------------------
Finished Handling Custom Attributes : Time (s): cpu = 00:00:27 ; elapsed = 00:00:34 . Memory (MB): peak = 1999.340 ; gain = 353.152 ; free physical = 8034 ; free virtual = 12933
---------------------------------------------------------------------------------
---------------------------------------------------------------------------------
Start Renaming Generated Nets
---------------------------------------------------------------------------------
---------------------------------------------------------------------------------
Finished Renaming Generated Nets : Time (s): cpu = 00:00:27 ; elapsed = 00:00:34 . Memory (MB): peak = 1999.340 ; gain = 353.152 ; free physical = 8034 ; free virtual = 12933
---------------------------------------------------------------------------------
---------------------------------------------------------------------------------
Start Writing Synthesis Report
---------------------------------------------------------------------------------

Report BlackBoxes: 
+------+----------------+----------+
|      |BlackBox name   |Instances |
+------+----------------+----------+
|1     |bd_0_hls_inst_0 |         1|
+------+----------------+----------+

Report Cell Usage: 
+------+-----------------------+------+
|      |Cell                   |Count |
+------+-----------------------+------+
|1     |bd_0_hls_inst_0_bbox_0 |     1|
+------+-----------------------+------+

Report Instance Areas: 
+------+---------+-------+------+
|      |Instance |Module |Cells |
+------+---------+-------+------+
|1     |top      |       |     6|
|2     |  bd_0_i |bd_0   |     6|
+------+---------+-------+------+
---------------------------------------------------------------------------------
Finished Writing Synthesis Report : Time (s): cpu = 00:00:27 ; elapsed = 00:00:34 . Memory (MB): peak = 1999.340 ; gain = 353.152 ; free physical = 8034 ; free virtual = 12933
---------------------------------------------------------------------------------
Synthesis finished with 0 errors, 0 critical warnings and 0 warnings.
Synthesis Optimization Runtime : Time (s): cpu = 00:00:25 ; elapsed = 00:00:31 . Memory (MB): peak = 1999.340 ; gain = 304.293 ; free physical = 8088 ; free virtual = 12987
Synthesis Optimization Complete : Time (s): cpu = 00:00:27 ; elapsed = 00:00:34 . Memory (MB): peak = 1999.348 ; gain = 353.152 ; free physical = 8088 ; free virtual = 12987
INFO: [Project 1-571] Translating synthesized netlist
Netlist sorting complete. Time (s): cpu = 00:00:00 ; elapsed = 00:00:00 . Memory (MB): peak = 1999.348 ; gain = 0.000 ; free physical = 8080 ; free virtual = 12980
INFO: [Project 1-570] Preparing netlist for logic optimization
INFO: [Opt 31-138] Pushed 0 inverter(s) to 0 load pin(s).
Netlist sorting complete. Time (s): cpu = 00:00:00 ; elapsed = 00:00:00 . Memory (MB): peak = 2009.246 ; gain = 0.000 ; free physical = 8099 ; free virtual = 12999
INFO: [Project 1-111] Unisim Transformation Summary:
No Unisim elements were transformed.

INFO: [Common 17-83] Releasing license: Synthesis
19 Infos, 0 Warnings, 0 Critical Warnings and 0 Errors encountered.
synth_design completed successfully
synth_design: Time (s): cpu = 00:00:36 ; elapsed = 00:00:44 . Memory (MB): peak = 2009.246 ; gain = 517.539 ; free physical = 8227 ; free virtual = 13127
Netlist sorting complete. Time (s): cpu = 00:00:00 ; elapsed = 00:00:00 . Memory (MB): peak = 2009.246 ; gain = 0.000 ; free physical = 8227 ; free virtual = 13127
WARNING: [Constraints 18-5210] No constraints selected for write.
Resolution: This message can indicate that there are no constraints for the design, or it can indicate that the used_in flags are set such that the constraints are ignored. This later case is used when running synth_design to not write synthesis constraints to the resulting checkpoint. Instead, project constraints are read when the synthesized design is opened.
INFO: [Common 17-1381] The checkpoint '/home/gigo/neural_net_HLS/solution1/impl/vhdl/project.runs/synth_1/bd_0_wrapper.dcp' has been generated.
INFO: [runtcl-4] Executing : report_utilization -file bd_0_wrapper_utilization_synth.rpt -pb bd_0_wrapper_utilization_synth.pb
INFO: [Common 17-206] Exiting Vivado at Mon May  4 11:22:39 2020...
[Mon May  4 11:22:42 2020] synth_1 finished
wait_on_run: Time (s): cpu = 00:05:12 ; elapsed = 00:05:55 . Memory (MB): peak = 1633.340 ; gain = 0.000 ; free physical = 8852 ; free virtual = 13749
Design is defaulting to impl run constrset: constrs_1
Design is defaulting to synth run part: xc7a35tcpg236-1
INFO: [Device 21-403] Loading part xc7a35tcpg236-1
INFO: [Project 1-454] Reading design checkpoint '/home/gigo/neural_net_HLS/solution1/impl/vhdl/project.srcs/sources_1/bd/bd_0/ip/bd_0_hls_inst_0/bd_0_hls_inst_0.dcp' for cell 'bd_0_i/hls_inst'
Netlist sorting complete. Time (s): cpu = 00:00:00.25 ; elapsed = 00:00:00.25 . Memory (MB): peak = 1784.281 ; gain = 0.000 ; free physical = 8706 ; free virtual = 13611
INFO: [Netlist 29-17] Analyzing 601 Unisim elements for replacement
INFO: [Netlist 29-28] Unisim Transformation completed in 0 CPU seconds
INFO: [Project 1-479] Netlist was created with Vivado 2019.2
INFO: [Project 1-570] Preparing netlist for logic optimization
Parsing XDC File [/home/gigo/neural_net_HLS/solution1/impl/vhdl/kernel.xdc]
Finished Parsing XDC File [/home/gigo/neural_net_HLS/solution1/impl/vhdl/kernel.xdc]
INFO: [Opt 31-138] Pushed 0 inverter(s) to 0 load pin(s).
Netlist sorting complete. Time (s): cpu = 00:00:00 ; elapsed = 00:00:00.01 . Memory (MB): peak = 1899.785 ; gain = 0.000 ; free physical = 8601 ; free virtual = 13503
INFO: [Project 1-111] Unisim Transformation Summary:
  A total of 32 instances were transformed.
  RAM128X1S => RAM128X1S (MUXF7, RAMS64E(x2)): 32 instances

open_run: Time (s): cpu = 00:00:13 ; elapsed = 00:00:21 . Memory (MB): peak = 1899.785 ; gain = 266.445 ; free physical = 8601 ; free virtual = 13503
Running report: report_utilization -file ./report/kernel_utilization_synth.rpt
Contents of report file './report/kernel_utilization_synth.rpt' is as follows:
Copyright 1986-2019 Xilinx, Inc. All Rights Reserved.
------------------------------------------------------------------------------------
| Tool Version : Vivado v.2019.2 (lin64) Build 2708876 Wed Nov  6 21:39:14 MST 2019
| Date         : Mon May  4 11:23:03 2020
| Host         : gigo-MacBookPro running 64-bit Ubuntu 18.04.3 LTS
| Command      : report_utilization -file ./report/kernel_utilization_synth.rpt
| Design       : bd_0_wrapper
| Device       : 7a35tcpg236-1
| Design State : Synthesized
------------------------------------------------------------------------------------

Utilization Design Information

Table of Contents
-----------------
1. Slice Logic
1.1 Summary of Registers by Type
2. Memory
3. DSP
4. IO and GT Specific
5. Clocking
6. Specific Feature
7. Primitives
8. Black Boxes
9. Instantiated Netlists

1. Slice Logic
--------------

+----------------------------+------+-------+-----------+-------+
|          Site Type         | Used | Fixed | Available | Util% |
+----------------------------+------+-------+-----------+-------+
| Slice LUTs*                | 4947 |     0 |     20800 | 23.78 |
|   LUT as Logic             | 3610 |     0 |     20800 | 17.36 |
|   LUT as Memory            | 1337 |     0 |      9600 | 13.93 |
|     LUT as Distributed RAM |   64 |     0 |           |       |
|     LUT as Shift Register  | 1273 |     0 |           |       |
| Slice Registers            | 5900 |     0 |     41600 | 14.18 |
|   Register as Flip Flop    | 5900 |     0 |     41600 | 14.18 |
|   Register as Latch        |    0 |     0 |     41600 |  0.00 |
| F7 Muxes                   |   35 |     0 |     16300 |  0.21 |
| F8 Muxes                   |    1 |     0 |      8150 |  0.01 |
+----------------------------+------+-------+-----------+-------+
* Warning! The Final LUT count, after physical optimizations and full implementation, is typically lower. Run opt_design after synthesis, if not already completed, for a more realistic count.


1.1 Summary of Registers by Type
--------------------------------

+-------+--------------+-------------+--------------+
| Total | Clock Enable | Synchronous | Asynchronous |
+-------+--------------+-------------+--------------+
| 0     |            _ |           - |            - |
| 0     |            _ |           - |          Set |
| 0     |            _ |           - |        Reset |
| 0     |            _ |         Set |            - |
| 0     |            _ |       Reset |            - |
| 0     |          Yes |           - |            - |
| 0     |          Yes |           - |          Set |
| 0     |          Yes |           - |        Reset |
| 57    |          Yes |         Set |            - |
| 5843  |          Yes |       Reset |            - |
+-------+--------------+-------------+--------------+


2. Memory
---------

+-------------------+------+-------+-----------+-------+
|     Site Type     | Used | Fixed | Available | Util% |
+-------------------+------+-------+-----------+-------+
| Block RAM Tile    |    6 |     0 |        50 | 12.00 |
|   RAMB36/FIFO*    |    2 |     0 |        50 |  4.00 |
|     RAMB36E1 only |    2 |       |           |       |
|   RAMB18          |    8 |     0 |       100 |  8.00 |
|     RAMB18E1 only |    8 |       |           |       |
+-------------------+------+-------+-----------+-------+
* Note: Each Block RAM Tile only has one FIFO logic available and therefore can accommodate only one FIFO36E1 or one FIFO18E1. However, if a FIFO18E1 occupies a Block RAM Tile, that tile can still accommodate a RAMB18E1


3. DSP
------

+----------------+------+-------+-----------+-------+
|    Site Type   | Used | Fixed | Available | Util% |
+----------------+------+-------+-----------+-------+
| DSPs           |   26 |     0 |        90 | 28.89 |
|   DSP48E1 only |   26 |       |           |       |
+----------------+------+-------+-----------+-------+


4. IO and GT Specific
---------------------

+-----------------------------+------+-------+-----------+-------+
|          Site Type          | Used | Fixed | Available | Util% |
+-----------------------------+------+-------+-----------+-------+
| Bonded IOB                  |    0 |     0 |       106 |  0.00 |
| Bonded IPADs                |    0 |     0 |        10 |  0.00 |
| Bonded OPADs                |    0 |     0 |         4 |  0.00 |
| PHY_CONTROL                 |    0 |     0 |         5 |  0.00 |
| PHASER_REF                  |    0 |     0 |         5 |  0.00 |
| OUT_FIFO                    |    0 |     0 |        20 |  0.00 |
| IN_FIFO                     |    0 |     0 |        20 |  0.00 |
| IDELAYCTRL                  |    0 |     0 |         5 |  0.00 |
| IBUFDS                      |    0 |     0 |       104 |  0.00 |
| GTPE2_CHANNEL               |    0 |     0 |         2 |  0.00 |
| PHASER_OUT/PHASER_OUT_PHY   |    0 |     0 |        20 |  0.00 |
| PHASER_IN/PHASER_IN_PHY     |    0 |     0 |        20 |  0.00 |
| IDELAYE2/IDELAYE2_FINEDELAY |    0 |     0 |       250 |  0.00 |
| IBUFDS_GTE2                 |    0 |     0 |         2 |  0.00 |
| ILOGIC                      |    0 |     0 |       106 |  0.00 |
| OLOGIC                      |    0 |     0 |       106 |  0.00 |
+-----------------------------+------+-------+-----------+-------+


5. Clocking
-----------

+------------+------+-------+-----------+-------+
|  Site Type | Used | Fixed | Available | Util% |
+------------+------+-------+-----------+-------+
| BUFGCTRL   |    0 |     0 |        32 |  0.00 |
| BUFIO      |    0 |     0 |        20 |  0.00 |
| MMCME2_ADV |    0 |     0 |         5 |  0.00 |
| PLLE2_ADV  |    0 |     0 |         5 |  0.00 |
| BUFMRCE    |    0 |     0 |        10 |  0.00 |
| BUFHCE     |    0 |     0 |        72 |  0.00 |
| BUFR       |    0 |     0 |        20 |  0.00 |
+------------+------+-------+-----------+-------+


6. Specific Feature
-------------------

+-------------+------+-------+-----------+-------+
|  Site Type  | Used | Fixed | Available | Util% |
+-------------+------+-------+-----------+-------+
| BSCANE2     |    0 |     0 |         4 |  0.00 |
| CAPTUREE2   |    0 |     0 |         1 |  0.00 |
| DNA_PORT    |    0 |     0 |         1 |  0.00 |
| EFUSE_USR   |    0 |     0 |         1 |  0.00 |
| FRAME_ECCE2 |    0 |     0 |         1 |  0.00 |
| ICAPE2      |    0 |     0 |         2 |  0.00 |
| PCIE_2_1    |    0 |     0 |         1 |  0.00 |
| STARTUPE2   |    0 |     0 |         1 |  0.00 |
| XADC        |    0 |     0 |         1 |  0.00 |
+-------------+------+-------+-----------+-------+


7. Primitives
-------------

+----------+------+---------------------+
| Ref Name | Used | Functional Category |
+----------+------+---------------------+
| FDRE     | 5843 |        Flop & Latch |
| LUT3     | 1698 |                 LUT |
| SRL16E   | 1089 |  Distributed Memory |
| LUT6     |  824 |                 LUT |
| LUT2     |  781 |                 LUT |
| LUT4     |  561 |                 LUT |
| SRLC32E  |  550 |  Distributed Memory |
| CARRY4   |  529 |          CarryLogic |
| LUT5     |  342 |                 LUT |
| LUT1     |  241 |                 LUT |
| RAMS64E  |   64 |  Distributed Memory |
| FDSE     |   57 |        Flop & Latch |
| MUXF7    |   35 |               MuxFx |
| DSP48E1  |   26 |    Block Arithmetic |
| RAMB18E1 |    8 |        Block Memory |
| RAMB36E1 |    2 |        Block Memory |
| MUXF8    |    1 |               MuxFx |
+----------+------+---------------------+


8. Black Boxes
--------------

+----------+------+
| Ref Name | Used |
+----------+------+


9. Instantiated Netlists
------------------------

+-----------------+------+
|     Ref Name    | Used |
+-----------------+------+
| bd_0_hls_inst_0 |    1 |
+-----------------+------+



Running report: report_timing_summary -file ./report/kernel_timing_synth.rpt
INFO: [Timing 38-35] Done setting XDC timing constraints.
INFO: [Timing 38-91] UpdateTimingParams: Speed grade: -1, Delay Type: min_max.
INFO: [Timing 38-191] Multithreading enabled for timing update using a maximum of 4 CPUs
WARNING: [Timing 38-242] The property HD.CLK_SRC of clock port "ap_clk" is not set. In out-of-context mode, this prevents timing estimation for clock delay/skew
Resolution: Set the HD.CLK_SRC property of the out-of-context port to the location of the clock buffer instance in the top-level design
report_timing_summary: Time (s): cpu = 00:00:21 ; elapsed = 00:00:18 . Memory (MB): peak = 2405.641 ; gain = 505.855 ; free physical = 8172 ; free virtual = 13090
Contents of report file './report/kernel_timing_synth.rpt' is as follows:
Copyright 1986-2019 Xilinx, Inc. All Rights Reserved.
------------------------------------------------------------------------------------
| Tool Version : Vivado v.2019.2 (lin64) Build 2708876 Wed Nov  6 21:39:14 MST 2019
| Date         : Mon May  4 11:23:21 2020
| Host         : gigo-MacBookPro running 64-bit Ubuntu 18.04.3 LTS
| Command      : report_timing_summary -file ./report/kernel_timing_synth.rpt
| Design       : bd_0_wrapper
| Device       : 7a35t-cpg236
| Speed File   : -1  PRODUCTION 1.23 2018-06-13
------------------------------------------------------------------------------------

Timing Summary Report

------------------------------------------------------------------------------------------------
| Timer Settings
| --------------
------------------------------------------------------------------------------------------------

  Enable Multi Corner Analysis               :  Yes
  Enable Pessimism Removal                   :  Yes
  Pessimism Removal Resolution               :  Nearest Common Node
  Enable Input Delay Default Clock           :  No
  Enable Preset / Clear Arcs                 :  No
  Disable Flight Delays                      :  No
  Ignore I/O Paths                           :  No
  Timing Early Launch at Borrowing Latches   :  No
  Borrow Time for Max Delay Exceptions       :  Yes
  Merge Timing Exceptions                    :  Yes

  Corner  Analyze    Analyze    
  Name    Max Paths  Min Paths  
  ------  ---------  ---------  
  Slow    Yes        Yes        
  Fast    Yes        Yes        



check_timing report

Table of Contents
-----------------
1. checking no_clock
2. checking constant_clock
3. checking pulse_width_clock
4. checking unconstrained_internal_endpoints
5. checking no_input_delay
6. checking no_output_delay
7. checking multiple_clock
8. checking generated_clocks
9. checking loops
10. checking partial_input_delay
11. checking partial_output_delay
12. checking latch_loops

1. checking no_clock
--------------------
 There are 0 register/latch pins with no clock.


2. checking constant_clock
--------------------------
 There are 0 register/latch pins with constant_clock.


3. checking pulse_width_clock
-----------------------------
 There are 0 register/latch pins which need pulse_width check


4. checking unconstrained_internal_endpoints
--------------------------------------------
 There are 0 pins that are not constrained for maximum delay.

 There are 0 pins that are not constrained for maximum delay due to constant clock.


5. checking no_input_delay
--------------------------
 There are 2 input ports with no input delay specified. (HIGH)

 There are 0 input ports with no input delay but user has a false path constraint.


6. checking no_output_delay
---------------------------
 There is 1 port with no output delay specified. (HIGH)

 There are 0 ports with no output delay but user has a false path constraint

 There are 0 ports with no output delay but with a timing clock defined on it or propagating through it


7. checking multiple_clock
--------------------------
 There are 0 register/latch pins with multiple clocks.


8. checking generated_clocks
----------------------------
 There are 0 generated clocks that are not connected to a clock source.


9. checking loops
-----------------
 There are 0 combinational loops in the design.


10. checking partial_input_delay
--------------------------------
 There are 0 input ports with partial input delay specified.


11. checking partial_output_delay
---------------------------------
 There are 0 ports with partial output delay specified.


12. checking latch_loops
------------------------
 There are 0 combinational latch loops in the design through latch input



------------------------------------------------------------------------------------------------
| Design Timing Summary
| ---------------------
------------------------------------------------------------------------------------------------

    WNS(ns)      TNS(ns)  TNS Failing Endpoints  TNS Total Endpoints      WHS(ns)      THS(ns)  THS Failing Endpoints  THS Total Endpoints     WPWS(ns)     TPWS(ns)  TPWS Failing Endpoints  TPWS Total Endpoints  
    -------      -------  ---------------------  -------------------      -------      -------  ---------------------  -------------------     --------     --------  ----------------------  --------------------  
      1.118        0.000                      0                17745        0.151        0.000                      0                17745        3.750        0.000                       0                  7643  


All user specified timing constraints are met.


------------------------------------------------------------------------------------------------
| Clock Summary
| -------------
------------------------------------------------------------------------------------------------

Clock   Waveform(ns)       Period(ns)      Frequency(MHz)
-----   ------------       ----------      --------------
ap_clk  {0.000 5.000}      10.000          100.000         


------------------------------------------------------------------------------------------------
| Intra Clock Table
| -----------------
------------------------------------------------------------------------------------------------

Clock             WNS(ns)      TNS(ns)  TNS Failing Endpoints  TNS Total Endpoints      WHS(ns)      THS(ns)  THS Failing Endpoints  THS Total Endpoints     WPWS(ns)     TPWS(ns)  TPWS Failing Endpoints  TPWS Total Endpoints  
-----             -------      -------  ---------------------  -------------------      -------      -------  ---------------------  -------------------     --------     --------  ----------------------  --------------------  
ap_clk              1.118        0.000                      0                17745        0.151        0.000                      0                17745        3.750        0.000                       0                  7643  


------------------------------------------------------------------------------------------------
| Inter Clock Table
| -----------------
------------------------------------------------------------------------------------------------

From Clock    To Clock          WNS(ns)      TNS(ns)  TNS Failing Endpoints  TNS Total Endpoints      WHS(ns)      THS(ns)  THS Failing Endpoints  THS Total Endpoints  
----------    --------          -------      -------  ---------------------  -------------------      -------      -------  ---------------------  -------------------  


------------------------------------------------------------------------------------------------
| Other Path Groups Table
| -----------------------
------------------------------------------------------------------------------------------------

Path Group    From Clock    To Clock          WNS(ns)      TNS(ns)  TNS Failing Endpoints  TNS Total Endpoints      WHS(ns)      THS(ns)  THS Failing Endpoints  THS Total Endpoints  
----------    ----------    --------          -------      -------  ---------------------  -------------------      -------      -------  ---------------------  -------------------  


------------------------------------------------------------------------------------------------
| Timing Details
| --------------
------------------------------------------------------------------------------------------------


---------------------------------------------------------------------------------------------------
From Clock:  ap_clk
  To Clock:  ap_clk

Setup :            0  Failing Endpoints,  Worst Slack        1.118ns,  Total Violation        0.000ns
Hold  :            0  Failing Endpoints,  Worst Slack        0.151ns,  Total Violation        0.000ns
PW    :            0  Failing Endpoints,  Worst Slack        3.750ns,  Total Violation        0.000ns
---------------------------------------------------------------------------------------------------


Max Delay Paths
--------------------------------------------------------------------------------------
Slack (MET) :             1.118ns  (required time - arrival time)
  Source:                 bd_0_i/hls_inst/U0/grp_act_fun_fu_522/kernel_dadddsub_6jbC_U31/kernel_ap_dadddsub_4_full_dsp_64_u/U0/i_synth/ADDSUB_OP.ADDSUB/LOGIC_SPEED.OP/EXP/NUMB_CMP/FAST_CMP.CMP_BOT/C_CHAIN/CHAIN_GEN[15].CARRYS_DEL.NEED_DEL.CARRYS_FD/C
                            (rising edge-triggered cell FDRE clocked by ap_clk  {rise@0.000ns fall@5.000ns period=10.000ns})
  Destination:            bd_0_i/hls_inst/U0/grp_act_fun_fu_522/kernel_dadddsub_6jbC_U31/kernel_ap_dadddsub_4_full_dsp_64_u/U0/i_synth/ADDSUB_OP.ADDSUB/LOGIC_SPEED.OP/ALIGN_BLK/FRAC_ADDSUB/DSP_ADD.FRAC_ADDSUB/DSP48E1_ADD.DSP48E1_ADD/DSP/CARRYIN
                            (rising edge-triggered cell DSP48E1 clocked by ap_clk  {rise@0.000ns fall@5.000ns period=10.000ns})
  Path Group:             ap_clk
  Path Type:              Setup (Max at Slow Process Corner)
  Requirement:            10.000ns  (ap_clk rise@10.000ns - ap_clk rise@0.000ns)
  Data Path Delay:        7.500ns  (logic 2.922ns (38.961%)  route 4.578ns (61.039%))
  Logic Levels:           11  (CARRY4=3 LUT2=1 LUT3=1 LUT4=2 LUT6=2 MUXF7=1 MUXF8=1)
  Clock Path Skew:        -0.049ns (DCD - SCD + CPR)
    Destination Clock Delay (DCD):    0.924ns = ( 10.924 - 10.000 ) 
    Source Clock Delay      (SCD):    0.973ns
    Clock Pessimism Removal (CPR):    0.000ns
  Clock Uncertainty:      0.035ns  ((TSJ^2 + TIJ^2)^1/2 + DJ) / 2 + PE
    Total System Jitter     (TSJ):    0.071ns
    Total Input Jitter      (TIJ):    0.000ns
    Discrete Jitter          (DJ):    0.000ns
    Phase Error              (PE):    0.000ns

    Location             Delay type                Incr(ns)  Path(ns)    Netlist Resource(s)
  -------------------------------------------------------------------    -------------------
                         (clock ap_clk rise edge)     0.000     0.000 r  
                                                      0.000     0.000 r  ap_clk (IN)
                         net (fo=7648, unset)         0.973     0.973    bd_0_i/hls_inst/U0/grp_act_fun_fu_522/kernel_dadddsub_6jbC_U31/kernel_ap_dadddsub_4_full_dsp_64_u/U0/i_synth/ADDSUB_OP.ADDSUB/LOGIC_SPEED.OP/EXP/NUMB_CMP/FAST_CMP.CMP_BOT/C_CHAIN/aclk
                         FDRE                                         r  bd_0_i/hls_inst/U0/grp_act_fun_fu_522/kernel_dadddsub_6jbC_U31/kernel_ap_dadddsub_4_full_dsp_64_u/U0/i_synth/ADDSUB_OP.ADDSUB/LOGIC_SPEED.OP/EXP/NUMB_CMP/FAST_CMP.CMP_BOT/C_CHAIN/CHAIN_GEN[15].CARRYS_DEL.NEED_DEL.CARRYS_FD/C
  -------------------------------------------------------------------    -------------------
                         FDRE (Prop_fdre_C_Q)         0.456     1.429 r  bd_0_i/hls_inst/U0/grp_act_fun_fu_522/kernel_dadddsub_6jbC_U31/kernel_ap_dadddsub_4_full_dsp_64_u/U0/i_synth/ADDSUB_OP.ADDSUB/LOGIC_SPEED.OP/EXP/NUMB_CMP/FAST_CMP.CMP_BOT/C_CHAIN/CHAIN_GEN[15].CARRYS_DEL.NEED_DEL.CARRYS_FD/Q
                         net (fo=5, unplaced)         0.769     2.198    bd_0_i/hls_inst/U0/grp_act_fun_fu_522/kernel_dadddsub_6jbC_U31/kernel_ap_dadddsub_4_full_dsp_64_u/U0/i_synth/ADDSUB_OP.ADDSUB/LOGIC_SPEED.OP/EXP/NUMB_CMP/FAST_CMP.CMP_BOT/C_CHAIN/CARRY_OUT
                         LUT3 (Prop_lut3_I0_O)        0.295     2.493 r  bd_0_i/hls_inst/U0/grp_act_fun_fu_522/kernel_dadddsub_6jbC_U31/kernel_ap_dadddsub_4_full_dsp_64_u/U0/i_synth/ADDSUB_OP.ADDSUB/LOGIC_SPEED.OP/EXP/NUMB_CMP/FAST_CMP.CMP_BOT/C_CHAIN/CHAIN_GEN[0].C_MUX.CARRY_MUX_i_2__0/O
                         net (fo=107, unplaced)       0.550     3.043    bd_0_i/hls_inst/U0/grp_act_fun_fu_522/kernel_dadddsub_6jbC_U31/kernel_ap_dadddsub_4_full_dsp_64_u/U0/i_synth/ADDSUB_OP.ADDSUB/LOGIC_SPEED.OP/A_IP_DELAY/i_pipe/b_largest
                         LUT6 (Prop_lut6_I4_O)        0.124     3.167 f  bd_0_i/hls_inst/U0/grp_act_fun_fu_522/kernel_dadddsub_6jbC_U31/kernel_ap_dadddsub_4_full_dsp_64_u/U0/i_synth/ADDSUB_OP.ADDSUB/LOGIC_SPEED.OP/A_IP_DELAY/i_pipe/CHAIN_GEN[1].C_MUX.CARRY_MUX_i_3/O
                         net (fo=2, unplaced)         0.913     4.080    bd_0_i/hls_inst/U0/grp_act_fun_fu_522/kernel_dadddsub_6jbC_U31/kernel_ap_dadddsub_4_full_dsp_64_u/U0/i_synth/ADDSUB_OP.ADDSUB/LOGIC_SPEED.OP/A_IP_DELAY/i_pipe/ALIGN_BLK/sml_shift_mux__105[6]
                         LUT4 (Prop_lut4_I1_O)        0.124     4.204 r  bd_0_i/hls_inst/U0/grp_act_fun_fu_522/kernel_dadddsub_6jbC_U31/kernel_ap_dadddsub_4_full_dsp_64_u/U0/i_synth/ADDSUB_OP.ADDSUB/LOGIC_SPEED.OP/A_IP_DELAY/i_pipe/CHAIN_GEN[1].C_MUX.CARRY_MUX_i_1__0/O
                         net (fo=1, unplaced)         0.000     4.204    bd_0_i/hls_inst/U0/grp_act_fun_fu_522/kernel_dadddsub_6jbC_U31/kernel_ap_dadddsub_4_full_dsp_64_u/U0/i_synth/ADDSUB_OP.ADDSUB/LOGIC_SPEED.OP/ALIGN_BLK/ALIGN_SHIFT/ALIGN_Z_D/EQ_ZERO/CARRY_ZERO_DET/A[1]
                         CARRY4 (Prop_carry4_S[1]_CO[3])
                                                      0.550     4.754 r  bd_0_i/hls_inst/U0/grp_act_fun_fu_522/kernel_dadddsub_6jbC_U31/kernel_ap_dadddsub_4_full_dsp_64_u/U0/i_synth/ADDSUB_OP.ADDSUB/LOGIC_SPEED.OP/ALIGN_BLK/ALIGN_SHIFT/ALIGN_Z_D/EQ_ZERO/CARRY_ZERO_DET/CHAIN_GEN[0].C_MUX.CARRY_MUX_CARRY4/CO[3]
                         net (fo=2, unplaced)         0.009     4.763    bd_0_i/hls_inst/U0/grp_act_fun_fu_522/kernel_dadddsub_6jbC_U31/kernel_ap_dadddsub_4_full_dsp_64_u/U0/i_synth/ADDSUB_OP.ADDSUB/LOGIC_SPEED.OP/ALIGN_BLK/ALIGN_SHIFT/ALIGN_Z_D/EQ_ZERO/CARRY_ZERO_DET/CARRYS_OUT[3]
                         CARRY4 (Prop_carry4_CI_CO[3])
                                                      0.114     4.877 r  bd_0_i/hls_inst/U0/grp_act_fun_fu_522/kernel_dadddsub_6jbC_U31/kernel_ap_dadddsub_4_full_dsp_64_u/U0/i_synth/ADDSUB_OP.ADDSUB/LOGIC_SPEED.OP/ALIGN_BLK/ALIGN_SHIFT/ALIGN_Z_D/EQ_ZERO/CARRY_ZERO_DET/CHAIN_GEN[4].C_MUX.CARRY_MUX_CARRY4/CO[3]
                         net (fo=2, unplaced)         0.000     4.877    bd_0_i/hls_inst/U0/grp_act_fun_fu_522/kernel_dadddsub_6jbC_U31/kernel_ap_dadddsub_4_full_dsp_64_u/U0/i_synth/ADDSUB_OP.ADDSUB/LOGIC_SPEED.OP/ALIGN_BLK/ALIGN_SHIFT/ALIGN_Z_D/EQ_ZERO/CARRY_ZERO_DET/CARRYS_OUT[7]
                         CARRY4 (Prop_carry4_CI_CO[1])
                                                      0.178     5.055 f  bd_0_i/hls_inst/U0/grp_act_fun_fu_522/kernel_dadddsub_6jbC_U31/kernel_ap_dadddsub_4_full_dsp_64_u/U0/i_synth/ADDSUB_OP.ADDSUB/LOGIC_SPEED.OP/ALIGN_BLK/ALIGN_SHIFT/ALIGN_Z_D/EQ_ZERO/CARRY_ZERO_DET/CHAIN_GEN[8].C_MUX.CARRY_MUX_CARRY4/CO[1]
                         net (fo=1, unplaced)         0.312     5.367    bd_0_i/hls_inst/U0/grp_act_fun_fu_522/kernel_dadddsub_6jbC_U31/kernel_ap_dadddsub_4_full_dsp_64_u/U0/i_synth/ADDSUB_OP.ADDSUB/LOGIC_SPEED.OP/EXP/BMA_EXP_DELAY/i_pipe/CARRYS_OUT[9]
                         LUT6 (Prop_lut6_I0_O)        0.332     5.699 f  bd_0_i/hls_inst/U0/grp_act_fun_fu_522/kernel_dadddsub_6jbC_U31/kernel_ap_dadddsub_4_full_dsp_64_u/U0/i_synth/ADDSUB_OP.ADDSUB/LOGIC_SPEED.OP/EXP/BMA_EXP_DELAY/i_pipe/MUX_LOOP[2].OTHER_LEVELS.DO_CHUNKS[0].LUT6_STRUCT_MUX.MUX1_i_3/O
                         net (fo=1, unplaced)         0.902     6.601    bd_0_i/hls_inst/U0/grp_act_fun_fu_522/kernel_dadddsub_6jbC_U31/kernel_ap_dadddsub_4_full_dsp_64_u/U0/i_synth/ADDSUB_OP.ADDSUB/LOGIC_SPEED.OP/EXP/BMA_EXP_DELAY/i_pipe/MUX_LOOP[2].OTHER_LEVELS.DO_CHUNKS[0].LUT6_STRUCT_MUX.MUX1_i_3_n_4
                         LUT4 (Prop_lut4_I0_O)        0.124     6.725 f  bd_0_i/hls_inst/U0/grp_act_fun_fu_522/kernel_dadddsub_6jbC_U31/kernel_ap_dadddsub_4_full_dsp_64_u/U0/i_synth/ADDSUB_OP.ADDSUB/LOGIC_SPEED.OP/EXP/BMA_EXP_DELAY/i_pipe/MUX_LOOP[2].OTHER_LEVELS.DO_CHUNKS[0].LUT6_STRUCT_MUX.MUX1_i_1/O
                         net (fo=1, unplaced)         0.000     6.725    bd_0_i/hls_inst/U0/grp_act_fun_fu_522/kernel_dadddsub_6jbC_U31/kernel_ap_dadddsub_4_full_dsp_64_u/U0/i_synth/ADDSUB_OP.ADDSUB/LOGIC_SPEED.OP/ALIGN_BLK/ALIGN_SHIFT/ALIGN_Z_D/zero_det_unreg[1]_3[2]
                         MUXF7 (Prop_muxf7_I0_O)      0.212     6.937 f  bd_0_i/hls_inst/U0/grp_act_fun_fu_522/kernel_dadddsub_6jbC_U31/kernel_ap_dadddsub_4_full_dsp_64_u/U0/i_synth/ADDSUB_OP.ADDSUB/LOGIC_SPEED.OP/ALIGN_BLK/ALIGN_SHIFT/ALIGN_Z_D/MUX_LOOP[2].OTHER_LEVELS.DO_CHUNKS[0].LUT6_STRUCT_MUX.MUX1/O
                         net (fo=1, unplaced)         0.000     6.937    bd_0_i/hls_inst/U0/grp_act_fun_fu_522/kernel_dadddsub_6jbC_U31/kernel_ap_dadddsub_4_full_dsp_64_u/U0/i_synth/ADDSUB_OP.ADDSUB/LOGIC_SPEED.OP/ALIGN_BLK/ALIGN_SHIFT/ALIGN_Z_D/mux0_1
                         MUXF8 (Prop_muxf8_I1_O)      0.094     7.031 f  bd_0_i/hls_inst/U0/grp_act_fun_fu_522/kernel_dadddsub_6jbC_U31/kernel_ap_dadddsub_4_full_dsp_64_u/U0/i_synth/ADDSUB_OP.ADDSUB/LOGIC_SPEED.OP/ALIGN_BLK/ALIGN_SHIFT/ALIGN_Z_D/MUX_LOOP[2].OTHER_LEVELS.DO_CHUNKS[0].LUT6_STRUCT_MUX.MUX2/O
                         net (fo=2, unplaced)         0.323     7.354    bd_0_i/hls_inst/U0/grp_act_fun_fu_522/kernel_dadddsub_6jbC_U31/kernel_ap_dadddsub_4_full_dsp_64_u/U0/i_synth/ADDSUB_OP.ADDSUB/LOGIC_SPEED.OP/EXP/SUB_DELAY/i_pipe/zeros_add
                         LUT2 (Prop_lut2_I1_O)        0.319     7.673 r  bd_0_i/hls_inst/U0/grp_act_fun_fu_522/kernel_dadddsub_6jbC_U31/kernel_ap_dadddsub_4_full_dsp_64_u/U0/i_synth/ADDSUB_OP.ADDSUB/LOGIC_SPEED.OP/EXP/SUB_DELAY/i_pipe/DSP_i_1/O
                         net (fo=1, unplaced)         0.800     8.473    bd_0_i/hls_inst/U0/grp_act_fun_fu_522/kernel_dadddsub_6jbC_U31/kernel_ap_dadddsub_4_full_dsp_64_u/U0/i_synth/ADDSUB_OP.ADDSUB/LOGIC_SPEED.OP/ALIGN_BLK/FRAC_ADDSUB/DSP_ADD.FRAC_ADDSUB/DSP48E1_ADD.DSP48E1_ADD/carry_in_del
                         DSP48E1                                      r  bd_0_i/hls_inst/U0/grp_act_fun_fu_522/kernel_dadddsub_6jbC_U31/kernel_ap_dadddsub_4_full_dsp_64_u/U0/i_synth/ADDSUB_OP.ADDSUB/LOGIC_SPEED.OP/ALIGN_BLK/FRAC_ADDSUB/DSP_ADD.FRAC_ADDSUB/DSP48E1_ADD.DSP48E1_ADD/DSP/CARRYIN
  -------------------------------------------------------------------    -------------------

                         (clock ap_clk rise edge)    10.000    10.000 r  
                                                      0.000    10.000 r  ap_clk (IN)
                         net (fo=7648, unset)         0.924    10.924    bd_0_i/hls_inst/U0/grp_act_fun_fu_522/kernel_dadddsub_6jbC_U31/kernel_ap_dadddsub_4_full_dsp_64_u/U0/i_synth/ADDSUB_OP.ADDSUB/LOGIC_SPEED.OP/ALIGN_BLK/FRAC_ADDSUB/DSP_ADD.FRAC_ADDSUB/DSP48E1_ADD.DSP48E1_ADD/aclk
                         DSP48E1                                      r  bd_0_i/hls_inst/U0/grp_act_fun_fu_522/kernel_dadddsub_6jbC_U31/kernel_ap_dadddsub_4_full_dsp_64_u/U0/i_synth/ADDSUB_OP.ADDSUB/LOGIC_SPEED.OP/ALIGN_BLK/FRAC_ADDSUB/DSP_ADD.FRAC_ADDSUB/DSP48E1_ADD.DSP48E1_ADD/DSP/CLK
                         clock pessimism              0.000    10.924    
                         clock uncertainty           -0.035    10.889    
                         DSP48E1 (Setup_dsp48e1_CLK_CARRYIN)
                                                     -1.298     9.591    bd_0_i/hls_inst/U0/grp_act_fun_fu_522/kernel_dadddsub_6jbC_U31/kernel_ap_dadddsub_4_full_dsp_64_u/U0/i_synth/ADDSUB_OP.ADDSUB/LOGIC_SPEED.OP/ALIGN_BLK/FRAC_ADDSUB/DSP_ADD.FRAC_ADDSUB/DSP48E1_ADD.DSP48E1_ADD/DSP
  -------------------------------------------------------------------
                         required time                          9.591    
                         arrival time                          -8.473    
  -------------------------------------------------------------------
                         slack                                  1.118    





Min Delay Paths
--------------------------------------------------------------------------------------
Slack (MET) :             0.151ns  (arrival time - required time)
  Source:                 bd_0_i/hls_inst/U0/grp_fft_top_fu_514/fft_config1_U0/inst/U0/i_synth/xfft_inst/non_floating_point.arch_d.xfft_inst/pe_gen[1].natural_order_input.PE/FB_1.BF_1/mem_mux_and_reg_upper_im/slicel_slicem_implementation.mux/use_lut6_2.latency1.Q_reg[0]/C
                            (rising edge-triggered cell FDRE clocked by ap_clk  {rise@0.000ns fall@5.000ns period=10.000ns})
  Destination:            bd_0_i/hls_inst/U0/grp_fft_top_fu_514/fft_config1_U0/inst/U0/i_synth/xfft_inst/non_floating_point.arch_d.xfft_inst/pe_gen[1].natural_order_input.PE/FB_1.BF_1/MEM/dist_ram.srlram.ram/fixed_length.shift_ram/i_bb_inst/f1.many_clbs.gen_width[0].srl_sig_reg[31]_srl32/D
                            (rising edge-triggered cell SRLC32E clocked by ap_clk  {rise@0.000ns fall@5.000ns period=10.000ns})
  Path Group:             ap_clk
  Path Type:              Hold (Min at Fast Process Corner)
  Requirement:            0.000ns  (ap_clk rise@0.000ns - ap_clk rise@0.000ns)
  Data Path Delay:        0.303ns  (logic 0.141ns (46.556%)  route 0.162ns (53.444%))
  Logic Levels:           0  
  Clock Path Skew:        0.022ns (DCD - SCD - CPR)
    Destination Clock Delay (DCD):    0.432ns
    Source Clock Delay      (SCD):    0.410ns
    Clock Pessimism Removal (CPR):    -0.000ns

    Location             Delay type                Incr(ns)  Path(ns)    Netlist Resource(s)
  -------------------------------------------------------------------    -------------------
                         (clock ap_clk rise edge)     0.000     0.000 r  
                                                      0.000     0.000 r  ap_clk (IN)
                         net (fo=7648, unset)         0.410     0.410    bd_0_i/hls_inst/U0/grp_fft_top_fu_514/fft_config1_U0/inst/U0/i_synth/xfft_inst/non_floating_point.arch_d.xfft_inst/pe_gen[1].natural_order_input.PE/FB_1.BF_1/mem_mux_and_reg_upper_im/slicel_slicem_implementation.mux/aclk
                         FDRE                                         r  bd_0_i/hls_inst/U0/grp_fft_top_fu_514/fft_config1_U0/inst/U0/i_synth/xfft_inst/non_floating_point.arch_d.xfft_inst/pe_gen[1].natural_order_input.PE/FB_1.BF_1/mem_mux_and_reg_upper_im/slicel_slicem_implementation.mux/use_lut6_2.latency1.Q_reg[0]/C
  -------------------------------------------------------------------    -------------------
                         FDRE (Prop_fdre_C_Q)         0.141     0.551 r  bd_0_i/hls_inst/U0/grp_fft_top_fu_514/fft_config1_U0/inst/U0/i_synth/xfft_inst/non_floating_point.arch_d.xfft_inst/pe_gen[1].natural_order_input.PE/FB_1.BF_1/mem_mux_and_reg_upper_im/slicel_slicem_implementation.mux/use_lut6_2.latency1.Q_reg[0]/Q
                         net (fo=1, unplaced)         0.162     0.713    bd_0_i/hls_inst/U0/grp_fft_top_fu_514/fft_config1_U0/inst/U0/i_synth/xfft_inst/non_floating_point.arch_d.xfft_inst/pe_gen[1].natural_order_input.PE/FB_1.BF_1/MEM/dist_ram.srlram.ram/fixed_length.shift_ram/i_bb_inst/d[0]
                         SRLC32E                                      r  bd_0_i/hls_inst/U0/grp_fft_top_fu_514/fft_config1_U0/inst/U0/i_synth/xfft_inst/non_floating_point.arch_d.xfft_inst/pe_gen[1].natural_order_input.PE/FB_1.BF_1/MEM/dist_ram.srlram.ram/fixed_length.shift_ram/i_bb_inst/f1.many_clbs.gen_width[0].srl_sig_reg[31]_srl32/D
  -------------------------------------------------------------------    -------------------

                         (clock ap_clk rise edge)     0.000     0.000 r  
                                                      0.000     0.000 r  ap_clk (IN)
                         net (fo=7648, unset)         0.432     0.432    bd_0_i/hls_inst/U0/grp_fft_top_fu_514/fft_config1_U0/inst/U0/i_synth/xfft_inst/non_floating_point.arch_d.xfft_inst/pe_gen[1].natural_order_input.PE/FB_1.BF_1/MEM/dist_ram.srlram.ram/fixed_length.shift_ram/i_bb_inst/clk
                         SRLC32E                                      r  bd_0_i/hls_inst/U0/grp_fft_top_fu_514/fft_config1_U0/inst/U0/i_synth/xfft_inst/non_floating_point.arch_d.xfft_inst/pe_gen[1].natural_order_input.PE/FB_1.BF_1/MEM/dist_ram.srlram.ram/fixed_length.shift_ram/i_bb_inst/f1.many_clbs.gen_width[0].srl_sig_reg[31]_srl32/CLK
                         clock pessimism              0.000     0.432    
                         SRLC32E (Hold_srlc32e_CLK_D)
                                                      0.130     0.562    bd_0_i/hls_inst/U0/grp_fft_top_fu_514/fft_config1_U0/inst/U0/i_synth/xfft_inst/non_floating_point.arch_d.xfft_inst/pe_gen[1].natural_order_input.PE/FB_1.BF_1/MEM/dist_ram.srlram.ram/fixed_length.shift_ram/i_bb_inst/f1.many_clbs.gen_width[0].srl_sig_reg[31]_srl32
  -------------------------------------------------------------------
                         required time                         -0.562    
                         arrival time                           0.713    
  -------------------------------------------------------------------
                         slack                                  0.151    





Pulse Width Checks
--------------------------------------------------------------------------------------
Clock Name:         ap_clk
Waveform(ns):       { 0.000 5.000 }
Period(ns):         10.000
Sources:            { ap_clk }

Check Type        Corner  Lib Pin             Reference Pin  Required(ns)  Actual(ns)  Slack(ns)  Location  Pin
Min Period        n/a     RAMB36E1/CLKARDCLK  n/a            2.944         10.000      7.056                bd_0_i/hls_inst/U0/grp_fft_top_fu_514/xk_channel_U/mem_reg_0/CLKARDCLK
Low Pulse Width   Fast    RAMS64E/CLK         n/a            1.250         5.000       3.750                bd_0_i/hls_inst/U0/grp_fft_top_fu_514/fft_config1_U0/inst/U0/i_synth/xfft_inst/non_floating_point.arch_d.xfft_inst/pe_gen[1].natural_order_input.PE/has_TW_mult.TW/twiddle_generator/tw2.twgen2/dist_ram.first_quarter_table_reg_0_127_0_0/HIGH/CLK
High Pulse Width  Slow    RAMS64E/CLK         n/a            1.250         5.000       3.750                bd_0_i/hls_inst/U0/grp_fft_top_fu_514/fft_config1_U0/inst/U0/i_synth/xfft_inst/non_floating_point.arch_d.xfft_inst/pe_gen[1].natural_order_input.PE/has_TW_mult.TW/twiddle_generator/tw2.twgen2/dist_ram.first_quarter_table_reg_0_127_0_0/HIGH/CLK




HLS EXTRACTION: calculating BRAM count: (8 bram18) + 2 * (2 bram36)
HLS EXTRACTION: synth area_totals:  0 20800 41600 90 100 0 0
HLS EXTRACTION: synth area_current: 0 4947 5900 26 12 0 1273 0 0 0
HLS EXTRACTION: generated /home/gigo/neural_net_HLS/solution1/impl/report/vhdl/kernel_export.xml


Implementation tool: Xilinx Vivado v.2019.2
Project:             neural_net_HLS
Solution:            solution1
Device target:       xc7a35t-cpg236-1
Report date:         Mon May 04 11:23:21 CEST 2020

#=== Post-Synthesis Resource usage ===
SLICE:            0
LUT:           4947
FF:            5900
DSP:             26
BRAM:            12
SRL:           1273
#=== Final timing ===
CP required:    10.000
CP achieved post-synthesis:    8.882
Timing met

HLS EXTRACTION: generated /home/gigo/neural_net_HLS/solution1/impl/report/vhdl/kernel_export.rpt
INFO: [Common 17-206] Exiting Vivado at Mon May  4 11:23:21 2020...
